{
  "allow_patterns": [
    "config.json",
    "generation_config.json",
    "model.safetensors",
    "preprocessor_config.json",
    "tokenizer_config.json",
    "vocab.json",
    "merges.txt",
    "speech_tokenizer/config.json",
    "speech_tokenizer/configuration.json",
    "speech_tokenizer/model.safetensors",
    "speech_tokenizer/preprocessor_config.json"
  ],
  "blocking_reasons": [],
  "cache_dir": "/home/ubuntu/.local/share/manus/desktops/31dff204ff863412739e6a2b0126e1b7a1eae5872cade75600ecdb5bf352b93b/cache/huggingface/hub",
  "download_ref": "5ecdb67327fd37bb2e042aab12ff7391903235d3",
  "download_requested": true,
  "downloaded_bytes": 4520159099,
  "elapsed_ms": 8160,
  "engine_id": "qwen3_tts",
  "expected_file_bytes": 4520159099,
  "file_count": 11,
  "files": [
    {
      "is_symlink_in_snapshot": true,
      "path": "config.json",
      "size_bytes": 4421
    },
    {
      "is_symlink_in_snapshot": true,
      "path": "generation_config.json",
      "size_bytes": 245
    },
    {
      "is_symlink_in_snapshot": true,
      "path": "merges.txt",
      "size_bytes": 1671839
    },
    {
      "is_symlink_in_snapshot": true,
      "path": "model.safetensors",
      "size_bytes": 3833402552
    },
    {
      "is_symlink_in_snapshot": true,
      "path": "preprocessor_config.json",
      "size_bytes": 127
    },
    {
      "is_symlink_in_snapshot": true,
      "path": "tokenizer_config.json",
      "size_bytes": 7344
    },
    {
      "is_symlink_in_snapshot": true,
      "path": "vocab.json",
      "size_bytes": 2776833
    },
    {
      "is_symlink_in_snapshot": true,
      "path": "speech_tokenizer/config.json",
      "size_bytes": 2336
    },
    {
      "is_symlink_in_snapshot": true,
      "path": "speech_tokenizer/configuration.json",
      "size_bytes": 76
    },
    {
      "is_symlink_in_snapshot": true,
      "path": "speech_tokenizer/model.safetensors",
      "size_bytes": 682293092
    },
    {
      "is_symlink_in_snapshot": true,
      "path": "speech_tokenizer/preprocessor_config.json",
      "size_bytes": 234
    }
  ],
  "hub_integrity": "huggingface_hub_download_verified; full-file hashes not recomputed locally",
  "inference_verified": false,
  "installation_performed": false,
  "license": "Apache-2.0",
  "maximum_download_bytes": 4600000000,
  "minimum_free_disk_bytes": 14339934592,
  "model_downloaded": true,
  "model_id": "Qwen/Qwen3-TTS-12Hz-1.7B-VoiceDesign",
  "model_variant": "voice_design",
  "notes": [
    "Plan mode performs no installation, network request, directory creation, or model load.",
    "An explicit --download is required; downloads use a fixed repository, immutable revision, file allowlist, one worker, process-tree RSS monitor, timeout, and shared one-job lock.",
    "A completed download is artifact evidence only; it does not verify model loading or CPU inference."
  ],
  "observed_free_disk_bytes": 55202091008,
  "peak_process_tree_rss_mb": 1233,
  "pinned_revision": "5ecdb67327fd37bb2e042aab12ff7391903235d3",
  "required_files": [
    "config.json",
    "generation_config.json",
    "model.safetensors",
    "preprocessor_config.json",
    "tokenizer_config.json",
    "vocab.json",
    "merges.txt",
    "speech_tokenizer/config.json",
    "speech_tokenizer/configuration.json",
    "speech_tokenizer/model.safetensors",
    "speech_tokenizer/preprocessor_config.json"
  ],
  "resolved_revision": "5ecdb67327fd37bb2e042aab12ff7391903235d3",
  "resource_preflight": {
    "blocking_reasons": [],
    "diagnostic_only": true,
    "engine_id": "qwen3_tts",
    "inference_verified": false,
    "installation_performed": false,
    "limits": {
      "cpu_threads": 2,
      "max_chunk_chars": 800,
      "maximum_process_tree_rss_mb": 10240,
      "minimum_available_memory_mb": 14336,
      "minimum_free_disk_mb": 8192,
      "smoke_timeout_seconds": 300
    },
    "model_downloaded": false,
    "notes": [
      "A passing preflight does not prove that model weights are present, load, or synthesize audio.",
      "RSS limits are enforced by polling and may overshoot between samples; this is not an OS hard memory limit."
    ],
    "observed": {
      "available_cpu_count": 8,
      "available_memory_mb": 19161,
      "current_process_tree_rss_mb": 21,
      "free_disk_mb": 52644,
      "resource_monitor_available": true
    },
    "schema_version": 1,
    "status": "READY_TO_ATTEMPT"
  },
  "schema_version": 1,
  "snapshot_path": "/home/ubuntu/.local/share/manus/desktops/31dff204ff863412739e6a2b0126e1b7a1eae5872cade75600ecdb5bf352b93b/cache/huggingface/hub/models--Qwen--Qwen3-TTS-12Hz-1.7B-VoiceDesign/snapshots/5ecdb67327fd37bb2e042aab12ff7391903235d3",
  "sources": [
    "https://huggingface.co/Qwen/Qwen3-TTS-12Hz-1.7B-VoiceDesign",
    "https://huggingface.co/api/models/Qwen/Qwen3-TTS-12Hz-1.7B-VoiceDesign/tree/5ecdb67327fd37bb2e042aab12ff7391903235d3?recursive=true&expand=true"
  ],
  "status": "DOWNLOADED"
}
